,_unit_id,_golden,_unit_state,_trusted_judgments,_last_judgment_at,choose_the_most_natural_answer_to_the_question_above,choose_the_most_natural_answer_to_the_question_above:confidence,_created_at,orig__unit_id,_updated_at,choose_the_most_natural_answer_to_the_question_above_gold,choose_the_most_natural_answer_to_the_question_above_gold_reason,would_you_be_able_to_tell_me_what_the_balance_on_my_room_is,Label,Diff,Low_confidence,Low_confidence & diff,both_low_conf_with_diff,high_conf_toby_low_conf_info_desk_with_diff,label_ml,cleaned_sent
2193,1811819119,False,finalized,5,7/15/2018 5:42:01,2,1.0,7/13/2018 18:17:21,1810991572,7/13/2018 18:17:21,,,Where should I leave the keys when I leave?,1,0,0,0,0,0,1,where should i leave the keys when i leave
2194,1811813395,False,finalized,5,7/15/2018 5:15:23,2,1.0,7/13/2018 18:16:35,1810985669,7/13/2018 18:16:35,,,Rm-216- is there a coin washer and dryer here?,1,0,0,0,0,0,1,rm is there a coin washer and dryer here
2195,1811818877,False,finalized,5,7/15/2018 18:48:54,0,0.604,7/13/2018 18:17:20,1810991305,7/13/2018 18:17:20,,,And how much are tickets?,0,0,1,0,0,0,0,and how much are tickets
2196,1811817413,False,finalized,5,7/15/2018 6:20:24,0,0.7941,7/13/2018 18:17:07,1810989796,7/13/2018 18:17:07,,,"No problem, the carrots, do you want the bag ones or singles?",0,0,0,0,0,0,0,no problem the carrots do you want the bag ones or singles
2197,1811816690,False,finalized,5,7/15/2018 8:26:26,0,0.8,7/13/2018 18:17:01,1810989047,7/13/2018 18:17:01,,,what is fee?,0,0,0,0,0,0,0,what is fee
2198,1811817647,False,finalized,5,7/15/2018 13:07:12,2,0.5882,7/13/2018 18:17:09,1810990037,7/13/2018 18:17:09,,,It's not an apartment room is it?,1,0,1,0,0,0,1,it s not an apartment room is it
2199,1811818540,False,finalized,6,7/15/2018 5:07:40,2,1.0,7/13/2018 18:17:17,1810990958,7/13/2018 18:17:17,,,One additional question does the hotel happen to have or sell disposable razors?,1,0,0,0,0,0,1,one additional question does the hotel happen to have or sell disposable razors
2200,1811818313,False,finalized,5,7/15/2018 18:35:41,2,1.0,7/13/2018 18:17:15,1810990724,7/13/2018 18:17:15,,,Can you tell me how get wifi?,1,0,0,0,0,0,1,can you tell me how get wifi
2201,1811817419,False,finalized,5,7/15/2018 16:10:43,0,0.7692,7/13/2018 18:17:07,1810989802,7/13/2018 18:17:07,,,Or can we order something through you?,0,0,0,0,0,0,0,or can we order something through you
2202,1811819031,False,finalized,6,7/15/2018 18:00:36,0,1.0,7/13/2018 18:17:21,1810991473,7/13/2018 18:17:21,,,Hi who is this?,0,0,0,0,0,0,0,hi who is this
2203,1811818598,False,finalized,5,7/15/2018 18:47:29,1,0.4,7/13/2018 18:17:17,1810991020,7/13/2018 18:17:17,,,Thank you it was great can you please text me my itemized invoice,0,0,1,0,0,0,0,thank you it was great can you please text me my itemized invoice
2204,1811814414,False,finalized,6,7/15/2018 17:00:24,3,0.5118,7/13/2018 18:16:42,1810986717,7/13/2018 18:16:42,,,"I guess we forgot to formally check out, we left at 10:45 is there anything further I need to do?",0,0,1,0,0,0,0,i guess we forgot to formally check out we left at is there anything further i need to do
2205,1811817486,False,finalized,5,7/16/2018 2:26:11,3,0.7924,7/13/2018 18:17:07,1810989872,7/13/2018 18:17:07,,,"Just landed in Austin, can you please send my room number?",0,0,0,0,0,0,0,just landed in austin can you please send my room number
2206,1811817286,False,finalized,5,7/15/2018 16:09:32,2,0.7864,7/13/2018 18:17:06,1810989665,7/13/2018 18:17:06,,,"The inside door is locked, how can i reach elevators ?",1,0,0,0,0,0,1,the inside door is locked how can i reach elevators
2207,1811816327,False,finalized,5,7/15/2018 14:32:20,0,0.8073,7/13/2018 18:16:58,1810988673,7/13/2018 18:16:58,,,So what exactly will you guys be doing for us?,0,0,0,0,0,0,0,so what exactly will you guys be doing for us
2208,1811819084,False,finalized,5,7/15/2018 18:19:05,2,1.0,7/13/2018 18:17:21,1810991532,7/13/2018 18:17:21,,,Yes what's the wifi access code?,1,0,0,0,0,0,1,yes what s the wifi access code
2209,1811816784,False,finalized,6,7/15/2018 18:10:20,2,0.8288,7/13/2018 18:17:01,1810989147,7/13/2018 18:17:01,,,How do you sign out your person Hulu account off the tv?,1,0,0,0,0,0,1,how do you sign out your person hulu account off the tv
2210,1811817811,False,finalized,5,7/15/2018 11:59:03,2,1.0,7/13/2018 18:17:10,1810990205,7/13/2018 18:17:10,,,How do you get into the pool,1,0,0,0,0,0,1,how do you get into the pool
2211,1811815639,False,finalized,5,7/15/2018 11:42:04,2,1.0,7/13/2018 18:16:52,1810987974,7/13/2018 18:16:52,,,Is taxi scheduled through hotel or do we just get it at the airport when we arrive?,1,0,0,0,0,0,1,is taxi scheduled through hotel or do we just get it at the airport when we arrive
2212,1811813891,False,finalized,5,7/15/2018 18:25:50,2,0.596,7/13/2018 18:16:38,1810986178,7/13/2018 18:16:38,,,"I need to print and sign something before scanning, is there a business center or printer I can use?",1,0,1,0,0,0,1,i need to print and sign something before scanning is there a business center or printer i can use
2213,1811815819,False,finalized,6,7/15/2018 8:20:06,0,0.6667,7/13/2018 18:16:54,1810988153,7/13/2018 18:16:54,,,and what time should I be ready ?,0,0,1,0,0,0,0,and what time should i be ready
2214,1811817334,False,finalized,6,7/15/2018 13:41:26,2,0.4878,7/13/2018 18:17:06,1810989713,7/13/2018 18:17:06,,,"If so, can we pick it up at concierge?",1,0,1,0,0,0,1,if so can we pick it up at concierge
2215,1811813809,False,finalized,5,7/15/2018 12:33:23,2,0.5619,7/13/2018 18:16:38,1810986093,7/13/2018 18:16:38,,,We ant get connected to the wifi is it down ?,1,0,1,0,0,0,1,we ant get connected to the wifi is it down
2216,1811815662,False,finalized,5,7/15/2018 18:35:17,3,0.3846,7/13/2018 18:16:52,1810987997,7/13/2018 18:16:52,,,It's so beautiful here can we stay forever!?!?..,0,0,1,0,0,0,0,it s so beautiful here can we stay forever
2217,1811817789,False,finalized,5,7/15/2018 12:40:16,2,0.8119,7/13/2018 18:17:10,1810990184,7/13/2018 18:17:10,,,"Sorry hit send too soon, can you let me know how I can submit preferences for the reservation.",1,0,0,0,0,0,1,sorry hit send too soon can you let me know how i can submit preferences for the reservation
2218,1811813190,False,finalized,5,7/14/2018 22:24:18,2,1.0,7/13/2018 18:16:33,1810985458,7/13/2018 18:16:33,,,How does the arcade work?,1,0,0,0,0,0,1,how does the arcade work
2219,1811816108,False,finalized,5,7/15/2018 20:49:00,1,0.8019,7/13/2018 18:16:56,1810988449,7/13/2018 18:16:56,,,Hi can we get additional cream and coffee for the apt?,0,0,0,0,0,0,0,hi can we get additional cream and coffee for the apt
2220,1811817651,False,finalized,5,7/15/2018 23:14:55,0,1.0,7/13/2018 18:17:09,1810990041,7/13/2018 18:17:09,,,tay or what is the charge?,0,0,0,0,0,0,0,tay or what is the charge
2221,1811814027,False,finalized,5,7/15/2018 7:27:19,0,1.0,7/13/2018 18:16:39,1810986314,7/13/2018 18:16:39,,,Can you tell me what they are and where the lot is?,0,0,0,0,0,0,0,can you tell me what they are and where the lot is
2222,1811818747,False,finalized,7,7/15/2018 5:07:09,2,0.6926,7/13/2018 18:17:19,1810991173,7/13/2018 18:17:19,,,What time can we check in?,1,0,1,0,0,0,1,what time can we check in
2223,1811813170,False,finalized,5,7/14/2018 22:29:40,1,0.7845,7/13/2018 18:16:33,1810985436,7/13/2018 18:16:33,,,Hi can you email me again the receipt i think i didnt get it..,0,0,0,0,0,0,0,hi can you email me again the receipt i think i didnt get it
2224,1811817072,False,finalized,5,7/16/2018 1:52:00,0,1.0,7/13/2018 18:17:04,1810989442,7/13/2018 18:17:04,,,what have you found?,0,0,0,0,0,0,0,what have you found
2225,1811815551,False,finalized,5,7/15/2018 7:31:18,2,1.0,7/13/2018 18:16:51,1810987883,7/13/2018 18:16:51,,,Do you have a recommendation on how we obtain his meds?,1,0,0,0,0,0,1,do you have a recommendation on how we obtain his meds
2226,1811813587,False,finalized,5,7/15/2018 22:05:04,1,1.0,7/13/2018 18:16:36,1810985869,7/13/2018 18:16:36,,,Will you text me when our room is ready?,0,0,0,0,0,0,0,will you text me when our room is ready
2227,1811813912,False,finalized,5,7/15/2018 18:46:58,0,0.5727,7/13/2018 18:16:39,1810986199,7/13/2018 18:16:39,,,Also do you guys have any larger hand held mirrors,0,0,1,0,0,0,0,also do you guys have any larger hand held mirrors
2228,1811815696,False,finalized,5,7/15/2018 10:09:58,2,1.0,7/13/2018 18:16:53,1810988031,7/13/2018 18:16:53,,,"It has been great, how long does the ledge serve breakfast",1,0,0,0,0,0,1,it has been great how long does the ledge serve breakfast
2229,1811818879,False,finalized,5,7/15/2018 9:55:57,2,1.0,7/13/2018 18:17:20,1810991307,7/13/2018 18:17:20,,,What time does the restaurant close for lunch?,1,0,0,0,0,0,1,what time does the restaurant close for lunch
2230,1811816174,False,finalized,5,7/15/2018 16:26:42,2,0.7836,7/13/2018 18:16:56,1810988517,7/13/2018 18:16:56,,,"Also, how does the reservation process work?",1,0,0,0,0,0,1,also how does the reservation process work
2231,1811816438,False,finalized,5,7/15/2018 18:41:30,2,0.4074,7/13/2018 18:16:59,1810988785,7/13/2018 18:16:59,,,"Hi, is it possible to get a later checkout tomorrow?",1,0,1,0,0,0,1,hi is it possible to get a later checkout tomorrow
2232,1811818325,False,finalized,5,7/15/2018 15:11:30,0,0.61,7/13/2018 18:17:15,1810990736,7/13/2018 18:17:15,,,"Sorry can you warm up imperial, i stated the wrong thing",0,0,1,0,0,0,0,sorry can you warm up imperial i stated the wrong thing
2233,1811818152,False,finalized,5,7/16/2018 4:32:29,2,1.0,7/13/2018 18:17:13,1810990561,7/13/2018 18:17:13,,,On which floor is the club?,1,0,0,0,0,0,1,on which floor is the club
2234,1811814965,False,finalized,5,7/15/2018 5:08:30,2,1.0,7/13/2018 18:16:47,1810987284,7/13/2018 18:16:47,,,At what time does the Spa close today?,1,0,0,0,0,0,1,at what time does the spa close today
2235,1811815491,False,finalized,5,7/15/2018 18:06:32,0,0.4016,7/13/2018 18:16:51,1810987818,7/13/2018 18:16:51,,,If outside where would it be?,0,0,1,0,0,0,0,if outside where would it be
2236,1811816786,False,finalized,5,7/15/2018 7:25:14,0,0.7876,7/13/2018 18:17:02,1810989149,7/13/2018 18:17:02,,,Or is it a charcoal grill?,0,0,0,0,0,0,0,or is it a charcoal grill
2237,1811815536,False,finalized,5,7/15/2018 20:29:44,2,0.8085,7/13/2018 18:16:51,1810987866,7/13/2018 18:16:51,,,"Also, do you guys have yoga?",1,0,0,0,0,0,1,also do you guys have yoga
2238,1811818601,False,finalized,5,7/15/2018 12:36:18,2,0.8095,7/13/2018 18:17:17,1810991023,7/13/2018 18:17:17,,,After 4 when can I check in,1,0,0,0,0,0,1,after when can i check in
2239,1811818140,False,finalized,5,7/16/2018 1:08:50,2,1.0,7/13/2018 18:17:13,1810990549,7/13/2018 18:17:13,,,Dearest dearest Pfister Butler what time is the pool open?,1,0,0,0,0,0,1,dearest dearest pfister butler what time is the pool open
2240,1811813433,False,finalized,5,7/15/2018 18:46:01,2,0.8037,7/13/2018 18:16:35,1810985710,7/13/2018 18:16:35,,,Where can we park we have been driving around for at least 2 hours,1,0,0,0,0,0,1,where can we park we have been driving around for at least hours
2241,1811815627,False,finalized,6,7/15/2018 16:13:27,0,0.8417,7/13/2018 18:16:52,1810987962,7/13/2018 18:16:52,,,What time do you offer?,0,0,0,0,0,0,0,what time do you offer
2242,1811818880,False,finalized,5,7/15/2018 7:43:04,2,0.81,7/13/2018 18:17:20,1810991308,7/13/2018 18:17:20,,,Can you recommend a place where we could hear blue grass music this evening?,1,0,0,0,0,0,1,can you recommend a place where we could hear blue grass music this evening
2243,1811819201,False,finalized,5,7/15/2018 16:10:06,3,0.8163,7/13/2018 18:17:22,1810991663,7/13/2018 18:17:22,,,Hello - can you please tell me what date my credit card was refunded.,0,0,0,0,0,0,0,hello can you please tell me what date my credit card was refunded
2244,1811816565,False,finalized,5,7/15/2018 10:10:32,2,1.0,7/13/2018 18:17:00,1810988917,7/13/2018 18:17:00,,,where do we park?,1,0,0,0,0,0,1,where do we park
2245,1811817389,False,finalized,5,7/16/2018 1:51:22,2,0.5895,7/13/2018 18:17:07,1810989770,7/13/2018 18:17:07,,,Yes... where do we go to get key?,1,0,1,0,0,0,1,yes where do we go to get key
2246,1811818963,False,finalized,5,7/15/2018 6:28:20,2,0.619,7/13/2018 18:17:20,1810991396,7/13/2018 18:17:20,,,We land around 8am... can we request an early check in ?,1,0,1,0,0,0,1,we land around am can we request an early check in
2247,1811813708,False,finalized,5,7/16/2018 1:44:18,2,0.8,7/13/2018 18:16:37,1810985993,7/13/2018 18:16:37,,,Wasn't sure what to use for wifi username?,1,0,0,0,0,0,1,wasn t sure what to use for wifi username
2248,1811817363,False,finalized,5,7/15/2018 22:27:28,2,1.0,7/13/2018 18:17:06,1810989743,7/13/2018 18:17:06,,,Also what are the key fobs on the counter for?,1,0,0,0,0,0,1,also what are the key fobs on the counter for
2249,1811819117,False,finalized,5,7/15/2018 15:08:49,0,0.5789,7/13/2018 18:17:21,1810991570,7/13/2018 18:17:21,,,chance that turned up when the unit was cleaned?,0,0,1,0,0,0,0,chance that turned up when the unit was cleaned
2250,1811816965,False,finalized,5,7/15/2018 18:19:05,2,0.6075,7/13/2018 18:17:03,1810989332,7/13/2018 18:17:03,,,I have reserved one parking spot for tonight is it possible to reserve another one?,1,0,1,0,0,0,1,i have reserved one parking spot for tonight is it possible to reserve another one
2251,1811818728,False,finalized,5,7/15/2018 14:39:29,2,0.8077,7/13/2018 18:17:18,1810991154,7/13/2018 18:17:18,,,Also how much is it to park non valet at hotel?,1,0,0,0,0,0,1,also how much is it to park non valet at hotel
2252,1811817771,False,finalized,5,7/15/2018 7:17:51,0,0.5905,7/13/2018 18:17:10,1810990164,7/13/2018 18:17:10,,,So how is your weekend going?,0,0,1,0,0,0,0,so how is your weekend going
2253,1811817746,False,finalized,6,7/15/2018 8:48:09,2,0.8393,7/13/2018 18:17:10,1810990136,7/13/2018 18:17:10,,,"We're in Austin, how early can we check in?",1,0,0,0,0,0,1,we re in austin how early can we check in
2254,1811813833,False,finalized,5,7/15/2018 18:04:41,2,0.7726,7/13/2018 18:16:38,1810986119,7/13/2018 18:16:38,,,"Hi, what time is check in?..",1,0,0,0,0,0,1,hi what time is check in
2255,1811813487,False,finalized,5,7/15/2018 12:46:27,2,1.0,7/13/2018 18:16:35,1810985766,7/13/2018 18:16:35,,,I was wondering what some good bars and clubs are?,1,0,0,0,0,0,1,i was wondering what some good bars and clubs are
2256,1811814669,False,finalized,6,7/15/2018 8:51:51,0,0.823,7/13/2018 18:16:44,1810986979,7/13/2018 18:16:44,,,"If yes, how much?",0,0,0,0,0,0,0,if yes how much
2257,1811814947,False,finalized,5,7/15/2018 16:37:08,3,0.8155,7/13/2018 18:16:46,1810987263,7/13/2018 18:16:46,,,Thank you we have been given room 305 do you have anything on the same side but higher up,0,0,0,0,0,0,0,thank you we have been given room do you have anything on the same side but higher up
2258,1811818275,False,finalized,6,7/15/2018 14:58:52,2,1.0,7/13/2018 18:17:14,1810990684,7/13/2018 18:17:14,,,What are breakfast hours in the club room & what are they serving today?,1,0,0,0,0,0,1,what are breakfast hours in the club room what are they serving today
2259,1811813828,False,finalized,5,7/15/2018 12:19:18,2,1.0,7/13/2018 18:16:38,1810986114,7/13/2018 18:16:38,,,"Hello, what type of coffee machine do you have in rooms?",1,0,0,0,0,0,1,hello what type of coffee machine do you have in rooms
2260,1811818186,False,finalized,5,7/15/2018 5:40:12,2,1.0,7/13/2018 18:17:13,1810990596,7/13/2018 18:17:13,,,where is a good beer pub near the hotel?,1,0,0,0,0,0,1,where is a good beer pub near the hotel
2261,1811818367,False,finalized,5,7/15/2018 19:15:09,2,1.0,7/13/2018 18:17:15,1810990780,7/13/2018 18:17:15,,,Where is the fitness center and what are the hours?,1,0,0,0,0,0,1,where is the fitness center and what are the hours
2262,1811814009,False,finalized,5,7/15/2018 15:21:33,0,1.0,7/13/2018 18:16:39,1810986296,7/13/2018 18:16:39,,,"I'm sorry, what was your name??",0,0,0,0,0,0,0,i m sorry what was your name
2263,1811818236,False,finalized,5,7/15/2018 9:39:45,2,1.0,7/13/2018 18:17:14,1810990645,7/13/2018 18:17:14,,,Do you know what time the club lounge officially serves food?,1,0,0,0,0,0,1,do you know what time the club lounge officially serves food
2264,1811815590,False,finalized,6,7/15/2018 9:46:47,2,0.8448,7/13/2018 18:16:52,1810987924,7/13/2018 18:16:52,,,Do you know how much the taxi will be from here to dinner and back?,1,0,0,0,0,0,1,do you know how much the taxi will be from here to dinner and back
2265,1811818282,False,finalized,5,7/15/2018 18:35:49,2,1.0,7/13/2018 18:17:14,1810990692,7/13/2018 18:17:14,,,And is there a sauna or steam room in the spa area?,1,0,0,0,0,0,1,and is there a sauna or steam room in the spa area
2266,1811819088,False,finalized,5,7/15/2018 20:15:36,2,0.8119,7/13/2018 18:17:21,1810991536,7/13/2018 18:17:21,,,How do you use Apple tv?,1,0,0,0,0,0,1,how do you use apple tv
2267,1811818766,False,finalized,6,7/15/2018 16:17:00,0,1.0,7/13/2018 18:17:19,1810991192,7/13/2018 18:17:19,,,But do you have options not to?,0,0,0,0,0,0,0,but do you have options not to
2268,1811814919,False,finalized,5,7/15/2018 19:41:26,1,0.6,7/13/2018 18:16:46,1810987234,7/13/2018 18:16:46,,,My bosses room is not ready can you give him a key to 1219 please which is my room.,0,0,1,0,0,0,0,my bosses room is not ready can you give him a key to please which is my room
2269,1811816137,False,finalized,5,7/15/2018 14:55:03,2,1.0,7/13/2018 18:16:56,1810988480,7/13/2018 18:16:56,,,"Hey we left at about 11:10, is there anything I need to do specifically to check out?",1,0,0,0,0,0,1,hey we left at about is there anything i need to do specifically to check out
2270,1811814248,False,finalized,5,7/15/2018 10:12:06,2,0.7882,7/13/2018 18:16:41,1810986545,7/13/2018 18:16:41,,,Can you tell me how to get on the wifi?,1,0,0,0,0,0,1,can you tell me how to get on the wifi
2271,1811814996,False,finalized,5,7/15/2018 6:10:31,3,0.5728,7/13/2018 18:16:47,1810987316,7/13/2018 18:16:47,,,"Hello, is there any availability of staying one more night?",0,0,1,0,0,0,0,hello is there any availability of staying one more night
2272,1811816514,False,finalized,5,7/15/2018 20:03:10,2,0.6178,7/13/2018 18:16:59,1810988864,7/13/2018 18:16:59,,,Are we allowed to use it and is there any special way to get inside?,1,0,1,0,0,0,1,are we allowed to use it and is there any special way to get inside
2273,1811816337,False,finalized,5,7/15/2018 21:16:23,2,0.8073,7/13/2018 18:16:58,1810988684,7/13/2018 18:16:58,,,"So, what is chaser ticket and how do I get it?",1,0,0,0,0,0,1,so what is chaser ticket and how do i get it
2274,1811816334,False,finalized,5,7/15/2018 15:21:29,2,0.7692,7/13/2018 18:16:58,1810988680,7/13/2018 18:16:58,,,What do we do about parking can we park anywhere or is there a bay for us?..,1,0,0,0,0,0,1,what do we do about parking can we park anywhere or is there a bay for us
2275,1811815675,False,finalized,5,7/15/2018 19:32:54,2,0.5898,7/13/2018 18:16:52,1810988010,7/13/2018 18:16:52,,,Do they take credit card or can you tell me how much $$ it will be to San Jose?,1,0,1,0,0,0,1,do they take credit card or can you tell me how much it will be to san jose
2276,1811818348,False,finalized,5,7/16/2018 1:20:39,2,1.0,7/13/2018 18:17:15,1810990759,7/13/2018 18:17:15,,,What floor is pool and how late is it open?,1,0,0,0,0,0,1,what floor is pool and how late is it open
2277,1811817287,False,finalized,5,7/15/2018 18:44:42,0,0.6101,7/13/2018 18:17:06,1810989666,7/13/2018 18:17:06,,,Will let you know at what time we plan to arrive on Wednesday,0,0,1,0,0,0,0,will let you know at what time we plan to arrive on wednesday
2278,1811813697,False,finalized,5,7/16/2018 3:10:47,1,0.8131,7/13/2018 18:16:37,1810985981,7/13/2018 18:16:37,,,If our room becomes available a little bit sooner tommorow can you send me a text.,0,0,0,0,0,0,0,if our room becomes available a little bit sooner tommorow can you send me a text
2279,1811814708,False,finalized,5,7/16/2018 3:22:00,3,0.402,7/13/2018 18:16:45,1810987020,7/13/2018 18:16:45,,,"Hello,can you please provide turndown for room 403 and replenish",0,0,1,0,0,0,0,hello can you please provide turndown for room and replenish
2280,1811817500,False,finalized,5,7/15/2018 17:48:35,0,0.7921,7/13/2018 18:17:08,1810989886,7/13/2018 18:17:08,,,Should I text you when I land?,0,0,0,0,0,0,0,should i text you when i land
2281,1811818884,False,finalized,5,7/15/2018 7:31:24,2,1.0,7/13/2018 18:17:20,1810991312,7/13/2018 18:17:20,,,do you have shuttles from the airport to the hotel?,1,0,0,0,0,0,1,do you have shuttles from the airport to the hotel
2282,1811814000,False,finalized,5,7/16/2018 2:11:40,2,0.5922,7/13/2018 18:16:39,1810986287,7/13/2018 18:16:39,,,How early can we check in and bag check?,1,0,1,0,0,0,1,how early can we check in and bag check
2283,1811814863,False,finalized,5,7/15/2018 20:51:50,2,0.7985,7/13/2018 18:16:46,1810987177,7/13/2018 18:16:46,,,"Hello, what time is check-out?",1,0,0,0,0,0,1,hello what time is check out
2284,1811818264,False,finalized,5,7/16/2018 5:00:10,0,0.4143,7/13/2018 18:17:14,1810990673,7/13/2018 18:17:14,,,"Please remind me, how much more for the parlor too?",0,0,1,0,0,0,0,please remind me how much more for the parlor too
2285,1811815400,False,finalized,5,7/15/2018 12:15:50,2,0.79,7/13/2018 18:16:50,1810987726,7/13/2018 18:16:50,,,"Hi Luis, do you happen to provide hair flat irons?",1,0,0,0,0,0,1,hi luis do you happen to provide hair flat irons
2286,1811815500,False,finalized,5,7/15/2018 22:19:37,0,1.0,7/13/2018 18:16:51,1810987828,7/13/2018 18:16:51,,,Uh oh so now what?,0,0,0,0,0,0,0,uh oh so now what
2287,1811815709,False,finalized,5,7/16/2018 2:13:18,2,1.0,7/13/2018 18:16:53,1810988044,7/13/2018 18:16:53,,,what is the best way to get to the hotel from the airport?,1,0,0,0,0,0,1,what is the best way to get to the hotel from the airport
2288,1811818443,False,finalized,5,7/15/2018 20:47:47,2,0.6204,7/13/2018 18:17:16,1810990857,7/13/2018 18:17:16,,,And can you confirm the hours for the Club Level?,1,0,1,0,0,0,1,and can you confirm the hours for the club level
2289,1811818763,False,finalized,5,7/15/2018 18:14:56,2,0.8037,7/13/2018 18:17:19,1810991189,7/13/2018 18:17:19,,,K thx and is there a frequent visitor program or other ways to get discounts?,1,0,0,0,0,0,1,k thx and is there a frequent visitor program or other ways to get discounts
2290,1811814746,False,finalized,5,7/16/2018 4:19:30,1,0.7943,7/13/2018 18:16:45,1810987059,7/13/2018 18:16:45,,,Can we have our dinner reservation list ready when we check in please too from Jeena,0,0,0,0,0,0,0,can we have our dinner reservation list ready when we check in please too from jeena
2291,1811817176,False,finalized,5,7/15/2018 14:51:00,2,0.7882,7/13/2018 18:17:05,1810989550,7/13/2018 18:17:05,,,Also do you folks provide maid service?,1,0,0,0,0,0,1,also do you folks provide maid service
2292,1811816759,False,finalized,5,7/15/2018 18:48:58,2,0.7905,7/13/2018 18:17:01,1810989121,7/13/2018 18:17:01,,,How do you get into the pool?,1,0,0,0,0,0,1,how do you get into the pool
2293,1811818339,False,finalized,5,7/15/2018 15:09:52,2,0.8155,7/13/2018 18:17:15,1810990750,7/13/2018 18:17:15,,,It's mark what do you show for arrivals,1,0,0,0,0,0,1,it s mark what do you show for arrivals
2294,1811813350,False,finalized,5,7/15/2018 23:12:50,1,0.8282,7/13/2018 18:16:34,1810985622,7/13/2018 18:16:34,,,Will you text us when our room is ready tomorrow?,0,0,0,0,0,0,0,will you text us when our room is ready tomorrow
2295,1811818020,False,finalized,5,7/15/2018 23:44:09,2,1.0,7/13/2018 18:17:12,1810990424,7/13/2018 18:17:12,,,What kind of pillows do you guys use?,1,0,0,0,0,0,1,what kind of pillows do you guys use
2296,1811816263,False,finalized,5,7/15/2018 19:09:23,0,0.6036,7/13/2018 18:16:57,1810988609,7/13/2018 18:16:57,,,but I wasn't sure where to send it?,0,0,1,0,0,0,0,but i wasn t sure where to send it
2297,1811816586,False,finalized,5,7/16/2018 1:49:50,0,0.7757,7/13/2018 18:17:00,1810988939,7/13/2018 18:17:00,,,"So she grabs a white ticket and goes down where I am parked, right?",0,0,0,0,0,0,0,so she grabs a white ticket and goes down where i am parked right
2298,1811817845,False,finalized,5,7/15/2018 19:50:33,2,0.7822,7/13/2018 18:17:11,1810990242,7/13/2018 18:17:11,,,How many rooms do you have at the guild Lamar union?,1,0,0,0,0,0,1,how many rooms do you have at the guild lamar union
2299,1811817209,False,finalized,5,7/15/2018 6:29:09,2,1.0,7/13/2018 18:17:05,1810989584,7/13/2018 18:17:05,,,Last question - the website was a bit confusing - where can we park car?,1,0,0,0,0,0,1,last question the website was a bit confusing where can we park car
2300,1811817170,False,finalized,5,7/16/2018 1:52:00,0,0.8095,7/13/2018 18:17:05,1810989544,7/13/2018 18:17:05,,,Cool - what's side winder like?,0,0,0,0,0,0,0,cool what s side winder like
2301,1811818572,False,finalized,5,7/16/2018 0:14:35,2,0.8113,7/13/2018 18:17:17,1810990992,7/13/2018 18:17:17,,,Can you tell me what time the pool closes?,1,0,0,0,0,0,1,can you tell me what time the pool closes
2302,1811818569,False,finalized,5,7/15/2018 14:37:31,2,1.0,7/13/2018 18:17:17,1810990989,7/13/2018 18:17:17,,,Do we need to check out at the front desk or can we leave the keys in the room,1,0,0,0,0,0,1,do we need to check out at the front desk or can we leave the keys in the room
2303,1811818088,False,finalized,5,7/15/2018 21:49:31,2,0.5794,7/13/2018 18:17:13,1810990495,7/13/2018 18:17:13,,,"Great , where is the ice",1,0,1,0,0,0,1,great where is the ice
2304,1811817090,False,finalized,5,7/15/2018 7:15:18,0,0.8137,7/13/2018 18:17:04,1810989460,7/13/2018 18:17:04,,,About how long will it take?,0,0,0,0,0,0,0,about how long will it take
2305,1811815269,False,finalized,6,7/15/2018 8:56:44,0,0.8522,7/13/2018 18:16:49,1810987592,7/13/2018 18:16:49,,,r tell me where I can buy them ?,0,0,0,0,0,0,0,r tell me where i can buy them
