,_unit_id,_golden,_unit_state,_trusted_judgments,_last_judgment_at,choose_the_most_natural_answer_to_the_question_above,choose_the_most_natural_answer_to_the_question_above:confidence,_created_at,orig__unit_id,_updated_at,choose_the_most_natural_answer_to_the_question_above_gold,choose_the_most_natural_answer_to_the_question_above_gold_reason,would_you_be_able_to_tell_me_what_the_balance_on_my_room_is,Label,Diff,Low_confidence,Low_confidence & diff,both_low_conf_with_diff,high_conf_toby_low_conf_info_desk_with_diff,label_ml,cleaned_sent
1301,1811813548,False,finalized,5,7/16/2018 4:28:00,2,0.8009999999999999,7/13/2018 18:16:36,1810985829,7/13/2018 18:16:36,,,Room 346 - how much does it cost to bowl?,1,0,0,0,0,0,1,room how much does it cost to bowl
1302,1811817284,False,finalized,5,7/16/2018 2:44:47,1,0.6381,7/13/2018 18:17:06,1810989661,7/13/2018 18:17:06,,,"We blew through the coffee in our room, can we get a restock?",0,0,1,0,0,0,0,we blew through the coffee in our room can we get a restock
1303,1811818932,False,finalized,5,7/16/2018 0:09:07,0,0.8205,7/13/2018 18:17:20,1810991363,7/13/2018 18:17:20,,,Or can we even get them?,0,0,0,0,0,0,0,or can we even get them
1304,1811814061,False,finalized,5,7/15/2018 20:38:42,0,1.0,7/13/2018 18:16:40,1810986348,7/13/2018 18:16:40,,,how incompetent is your hotel?,0,0,0,0,0,0,0,how incompetent is your hotel
1305,1811817468,False,finalized,5,7/16/2018 3:06:24,2,0.5833,7/13/2018 18:17:07,1810989853,7/13/2018 18:17:07,,,I haven't received the secure access code and link to instructions on how to enter the building,1,0,1,0,0,0,1,i haven t received the secure access code and link to instructions on how to enter the building
1306,1811817001,False,finalized,5,7/15/2018 4:41:59,2,0.7917,7/13/2018 18:17:03,1810989369,7/13/2018 18:17:03,,,John what's the checkout policy?,1,0,0,0,0,0,1,john what s the checkout policy
1307,1811818133,False,finalized,5,7/15/2018 23:52:56,2,0.77,7/13/2018 18:17:13,1810990542,7/13/2018 18:17:13,,,Do you know what room the digital measures breakfast is being held?,1,0,0,0,0,0,1,do you know what room the digital measures breakfast is being held
1308,1811818168,False,finalized,5,7/15/2018 10:30:38,0,0.4158,7/13/2018 18:17:13,1810990577,7/13/2018 18:17:13,,,Hey it's mark can you tell me how arrivals are left,0,0,1,0,0,0,0,hey it s mark can you tell me how arrivals are left
1309,1811813406,False,finalized,6,7/15/2018 13:36:18,0,1.0,7/13/2018 18:16:35,1810985680,7/13/2018 18:16:35,,,can you instruct me of how to do it,0,0,0,0,0,0,0,can you instruct me of how to do it
1310,1811814004,False,finalized,5,7/15/2018 10:34:16,2,0.7963,7/13/2018 18:16:39,1810986291,7/13/2018 18:16:39,,,"Hi, is it possible to check in around 7 AM?",1,0,0,0,0,0,1,hi is it possible to check in around am
1311,1811817812,False,finalized,5,7/15/2018 14:43:23,2,0.5888,7/13/2018 18:17:10,1810990206,7/13/2018 18:17:10,,,"Oh okay, what's the maximum of people that are allowed to stay per room?",1,0,1,0,0,0,1,oh okay what s the maximum of people that are allowed to stay per room
1312,1811813219,False,finalized,5,7/15/2018 21:21:03,2,1.0,7/13/2018 18:16:33,1810985488,7/13/2018 18:16:33,,,When does the store on the 6th floor open,1,0,0,0,0,0,1,when does the store on the th floor open
1313,1811815894,False,finalized,5,7/16/2018 1:09:50,0,0.7723,7/13/2018 18:16:54,1810988231,7/13/2018 18:16:54,,,Thank you and who is this?,0,0,0,0,0,0,0,thank you and who is this
1314,1811816876,False,finalized,5,7/15/2018 23:41:04,2,1.0,7/13/2018 18:17:02,1810989240,7/13/2018 18:17:02,,,Hi - how do you get to the pool?,1,0,0,0,0,0,1,hi how do you get to the pool
1315,1811813943,False,finalized,5,7/16/2018 0:20:33,2,1.0,7/13/2018 18:16:39,1810986231,7/13/2018 18:16:39,,,is there a good breakfast spot in the hotel or nearby?,1,0,0,0,0,0,1,is there a good breakfast spot in the hotel or nearby
1316,1811813422,False,finalized,6,7/15/2018 9:05:08,0,0.6983,7/13/2018 18:16:35,1810985698,7/13/2018 18:16:35,,,If so can you give us the address?,0,0,1,0,0,0,0,if so can you give us the address
1317,1811818453,False,finalized,5,7/15/2018 18:34:26,2,1.0,7/13/2018 18:17:16,1810990867,7/13/2018 18:17:16,,,If so what is their phone number?,1,0,0,0,0,0,1,if so what is their phone number
1318,1811819205,False,finalized,5,7/15/2018 19:18:54,3,1.0,7/13/2018 18:17:22,1810991667,7/13/2018 18:17:22,,,"We are actually looking for a room tonight, can we extend our stay for tonight also?",0,0,0,0,0,0,0,we are actually looking for a room tonight can we extend our stay for tonight also
1319,1811814128,False,finalized,5,7/15/2018 20:08:15,2,0.5906,7/13/2018 18:16:40,1810986417,7/13/2018 18:16:40,,,"Hello Shelly, what about the parking?",1,0,1,0,0,0,1,hello shelly what about the parking
1320,1811817032,False,finalized,6,7/15/2018 4:57:57,2,1.0,7/13/2018 18:17:04,1810989400,7/13/2018 18:17:04,,,"One last question, where do we enter a promotion code?",1,0,0,0,0,0,1,one last question where do we enter a promotion code
1321,1811815135,False,finalized,5,7/15/2018 9:42:02,2,1.0,7/13/2018 18:16:48,1810987455,7/13/2018 18:16:48,,,".Yes, do you know of any close Walmart or grocery stores close to the hotel?",1,0,0,0,0,0,1,yes do you know of any close walmart or grocery stores close to the hotel
1322,1811817065,False,finalized,5,7/15/2018 18:31:08,2,1.0,7/13/2018 18:17:04,1810989434,7/13/2018 18:17:04,,,"Hi, what would be the WiFi access code?",1,0,0,0,0,0,1,hi what would be the wifi access code
1323,1811816271,False,finalized,8,7/15/2018 14:36:33,2,0.7292,7/13/2018 18:16:57,1810988617,7/13/2018 18:16:57,,,What do you need from the card info?,1,0,0,0,0,0,1,what do you need from the card info
1324,1811819009,False,finalized,5,7/15/2018 6:19:08,1,0.7885,7/13/2018 18:17:21,1810991448,7/13/2018 18:17:21,,,Can we have a bottle of Chardonnay on ice in our room for when we get there,0,0,0,0,0,0,0,can we have a bottle of chardonnay on ice in our room for when we get there
1325,1811815202,False,finalized,5,7/15/2018 22:22:20,0,1.0,7/13/2018 18:16:49,1810987522,7/13/2018 18:16:49,,,so what you do your $75,0,0,0,0,0,0,0,so what you do your
1326,1811816284,False,finalized,5,7/15/2018 17:06:47,2,1.0,7/13/2018 18:16:57,1810988630,7/13/2018 18:16:57,,,Hello my friend actually just arrived is there any way she can park her car in garage too?,1,0,0,0,0,0,1,hello my friend actually just arrived is there any way she can park her car in garage too
1327,1811815403,False,finalized,5,7/15/2018 7:08:20,1,0.8,7/13/2018 18:16:50,1810987729,7/13/2018 18:16:50,,,"If I reply to this number, can you call me?",0,0,0,0,0,0,0,if i reply to this number can you call me
1328,1811818554,False,finalized,5,7/16/2018 1:54:25,2,1.0,7/13/2018 18:17:17,1810990974,7/13/2018 18:17:17,,,Hello and can you confirm how late the Club level is serving breakfast this morning?,1,0,0,0,0,0,1,hello and can you confirm how late the club level is serving breakfast this morning
1329,1811815260,False,finalized,6,7/15/2018 7:19:25,2,0.8338,7/13/2018 18:16:49,1810987583,7/13/2018 18:16:49,,,Ok great can we store our luggage with the bell desk?,1,0,0,0,0,0,1,ok great can we store our luggage with the bell desk
1330,1811816126,False,finalized,5,7/16/2018 2:48:42,0,1.0,7/13/2018 18:16:56,1810988468,7/13/2018 18:16:56,,,Ps how did the straight girl manage to pick up last night at a gay bar?????,0,0,0,0,0,0,0,ps how did the straight girl manage to pick up last night at a gay bar
1331,1811818272,False,finalized,5,7/16/2018 0:28:22,2,1.0,7/13/2018 18:17:14,1810990681,7/13/2018 18:17:14,,,where can I leave/drop off a tip?,1,0,0,0,0,0,1,where can i leave drop off a tip
1332,1811818486,False,finalized,5,7/15/2018 13:59:07,2,0.7941,7/13/2018 18:17:16,1810990900,7/13/2018 18:17:16,,,When are the hors d'oeuvres and where,1,0,0,0,0,0,1,when are the hors d oeuvres and where
1333,1811818311,False,finalized,5,7/16/2018 3:12:48,0,0.4182,7/13/2018 18:17:15,1810990722,7/13/2018 18:17:15,,,Yes can you bring the keys up,0,0,1,0,0,0,0,yes can you bring the keys up
1334,1811816527,False,finalized,5,7/15/2018 7:16:28,2,1.0,7/13/2018 18:16:59,1810988878,7/13/2018 18:16:59,,,Did you find out how much the conference room is?,1,0,0,0,0,0,1,did you find out how much the conference room is
1335,1811815682,False,finalized,5,7/15/2018 17:31:32,0,0.7981,7/13/2018 18:16:52,1810988017,7/13/2018 18:16:52,,,Sorry I meant *what is the best place,0,0,0,0,0,0,0,sorry i meant what is the best place
1336,1811817227,False,finalized,5,7/15/2018 19:05:06,0,0.6019,7/13/2018 18:17:05,1810989602,7/13/2018 18:17:05,,,Can I use it when we check out?,0,0,1,0,0,0,0,can i use it when we check out
1337,1811813852,False,finalized,5,7/15/2018 13:38:38,2,1.0,7/13/2018 18:16:38,1810986138,7/13/2018 18:16:38,,,How do you connect to Wi-Fi?,1,0,0,0,0,0,1,how do you connect to wi fi
1338,1811817854,False,finalized,5,7/15/2018 19:20:11,2,0.7944,7/13/2018 18:17:11,1810990254,7/13/2018 18:17:11,,,"Hi, how do I login to the wifi?",1,0,0,0,0,0,1,hi how do i login to the wifi
1339,1811819096,False,finalized,5,7/15/2018 10:37:22,2,0.5859,7/13/2018 18:17:21,1810991546,7/13/2018 18:17:21,,,"Hi this is Fei, could you help me check is there any locket code ?",1,0,1,0,0,0,1,hi this is fei could you help me check is there any locket code
1340,1811813816,False,finalized,5,7/16/2018 1:24:15,2,0.8095,7/13/2018 18:16:38,1810986100,7/13/2018 18:16:38,,,Do the people who check in early rooms get cleaned first? ..,1,0,0,0,0,0,1,do the people who check in early rooms get cleaned first
1341,1811817928,False,finalized,5,7/15/2018 18:19:30,2,0.8037,7/13/2018 18:17:11,1810990327,7/13/2018 18:17:11,,,Could you let me know when there is parking available in your ramp or with valet?,1,0,0,0,0,0,1,could you let me know when there is parking available in your ramp or with valet
1342,1811816922,False,finalized,5,7/15/2018 5:23:22,2,1.0,7/13/2018 18:17:03,1810989287,7/13/2018 18:17:03,,,Can I park anywhere or is there a specific space for me?,1,0,0,0,0,0,1,can i park anywhere or is there a specific space for me
1343,1811816366,False,finalized,5,7/15/2018 18:43:53,2,1.0,7/13/2018 18:16:58,1810988715,7/13/2018 18:16:58,,,"This is Derryberry, we have a room but don’t know how to access.",1,0,0,0,0,0,1,this is derryberry we have a room but don t know how to access
1344,1811817983,False,finalized,5,7/16/2018 1:09:50,2,0.604,7/13/2018 18:17:12,1810990384,7/13/2018 18:17:12,,,"When does the loud, thumping music stop?",1,0,1,0,0,0,1,when does the loud thumping music stop
1345,1811816261,False,finalized,5,7/15/2018 22:10:16,2,1.0,7/13/2018 18:16:57,1810988607,7/13/2018 18:16:57,,,And what time is late check out?,1,0,0,0,0,0,1,and what time is late check out
1346,1811814159,False,finalized,5,7/15/2018 16:07:51,1,1.0,7/13/2018 18:16:40,1810986452,7/13/2018 18:16:40,,,Hi can you please send up more towels?,0,0,0,0,0,0,0,hi can you please send up more towels
1347,1811814790,False,finalized,5,7/15/2018 13:51:53,2,1.0,7/13/2018 18:16:45,1810987103,7/13/2018 18:16:45,,,Hello who do I contact about tennis court rentals?,1,0,0,0,0,0,1,hello who do i contact about tennis court rentals
1348,1811814262,False,finalized,5,7/15/2018 20:05:43,2,1.0,7/13/2018 18:16:41,1810986559,7/13/2018 18:16:41,,,What time does the coffee shop in the lobby open?,1,0,0,0,0,0,1,what time does the coffee shop in the lobby open
1349,1811818740,False,finalized,5,7/15/2018 12:19:18,2,1.0,7/13/2018 18:17:19,1810991166,7/13/2018 18:17:19,,,And what time is check in?,1,0,0,0,0,0,1,and what time is check in
1350,1811813930,False,finalized,5,7/15/2018 18:35:41,2,1.0,7/13/2018 18:16:39,1810986217,7/13/2018 18:16:39,,,is there early check in?,1,0,0,0,0,0,1,is there early check in
1351,1811817823,False,finalized,5,7/15/2018 6:03:19,0,0.5943,7/13/2018 18:17:10,1810990220,7/13/2018 18:17:10,,,do you want my email or just via text,0,0,1,0,0,0,0,do you want my email or just via text
1352,1811813232,False,finalized,5,7/14/2018 22:25:43,1,0.797,7/13/2018 18:16:33,1810985501,7/13/2018 18:16:33,,,Can we please be notified when our room is ready?,0,0,0,0,0,0,0,can we please be notified when our room is ready
1353,1811814963,False,finalized,5,7/15/2018 19:03:52,2,0.8131,7/13/2018 18:16:47,1810987282,7/13/2018 18:16:47,,,"We plan to self park during our stay, should we check in before parking or can we go ahead and park?",1,0,0,0,0,0,1,we plan to self park during our stay should we check in before parking or can we go ahead and park
1354,1811815635,False,finalized,5,7/15/2018 13:47:21,0,0.7921,7/13/2018 18:16:52,1810987970,7/13/2018 18:16:52,,,Let’s keep Farallon and find out what time if any is at sunset Mona Lisa.,0,0,0,0,0,0,0,let s keep farallon and find out what time if any is at sunset mona lisa
1355,1811813347,False,finalized,5,7/15/2018 1:36:49,2,0.4327,7/13/2018 18:16:34,1810985618,7/13/2018 18:16:34,,,is there anyway you can turn the subtitles off?,1,0,1,0,0,0,1,is there anyway you can turn the subtitles off
1356,1811814795,False,finalized,5,7/15/2018 19:25:18,1,0.8086,7/13/2018 18:16:45,1810987108,7/13/2018 18:16:45,,,Hello can you all bring around my car?,0,0,0,0,0,0,0,hello can you all bring around my car
1357,1811814028,False,finalized,5,7/15/2018 5:42:01,0,1.0,7/13/2018 18:16:39,1810986315,7/13/2018 18:16:39,,,Wayne what car are you driving?,0,0,0,0,0,0,0,wayne what car are you driving
1358,1811817108,False,finalized,5,7/15/2018 18:58:38,2,0.5988,7/13/2018 18:17:04,1810989480,7/13/2018 18:17:04,,,"Hi, is it possible to check in a little earlier?",1,0,1,0,0,0,1,hi is it possible to check in a little earlier
1359,1811813880,False,finalized,5,7/15/2018 13:48:43,2,0.7961,7/13/2018 18:16:38,1810986167,7/13/2018 18:16:38,,,"question-- if i needed to borrow an umbrella later, do you have any spares at the front desk?",1,0,0,0,0,0,1,question if i needed to borrow an umbrella later do you have any spares at the front desk
1360,1811814285,False,finalized,5,7/16/2018 1:50:34,0,1.0,7/13/2018 18:16:41,1810986582,7/13/2018 18:16:41,,,No one is there at the moment,0,0,0,0,0,0,0,no one is there at the moment
1361,1811816054,False,finalized,5,7/15/2018 16:08:05,2,1.0,7/13/2018 18:16:55,1810988397,7/13/2018 18:16:55,,,Question: does the apartment have HBO go ?,1,0,0,0,0,0,1,question does the apartment have hbo go
1362,1811813161,False,finalized,5,7/14/2018 22:23:21,2,1.0,7/13/2018 18:16:33,1810985426,7/13/2018 18:16:33,,,Do you have roll away beds and do you charge for them?,1,0,0,0,0,0,1,do you have roll away beds and do you charge for them
1363,1811817848,False,finalized,5,7/15/2018 18:29:20,0,0.7856,7/13/2018 18:17:11,1810990246,7/13/2018 18:17:11,,,How much strawberries do you want?,0,0,0,0,0,0,0,how much strawberries do you want
1364,1811817473,False,finalized,6,7/15/2018 14:57:18,2,1.0,7/13/2018 18:17:07,1810989859,7/13/2018 18:17:07,,,"No worries at all, is it too late for us to register for parking?",1,0,0,0,0,0,1,no worries at all is it too late for us to register for parking
1365,1811815345,False,finalized,6,7/15/2018 8:26:45,2,1.0,7/13/2018 18:16:50,1810987672,7/13/2018 18:16:50,,,"Thanks for the info~ If i rent a car, is there a parking service at hotel?",1,0,0,0,0,0,1,thanks for the info if i rent a car is there a parking service at hotel
1366,1811819138,False,finalized,5,7/15/2018 21:27:54,0,1.0,7/13/2018 18:17:22,1810991593,7/13/2018 18:17:22,,,"when i went to work, it was still there.",0,0,0,0,0,0,0,when i went to work it was still there
1367,1811815596,False,finalized,5,7/15/2018 8:26:50,2,1.0,7/13/2018 18:16:52,1810987930,7/13/2018 18:16:52,,,Where can we go on foot if we leave the hotel properly?,1,0,0,0,0,0,1,where can we go on foot if we leave the hotel properly
1368,1811813597,False,finalized,5,7/15/2018 7:40:11,0,1.0,7/13/2018 18:16:36,1810985880,7/13/2018 18:16:36,,,"If I want to use it, is there a way to get it open?",0,0,0,0,0,0,0,if i want to use it is there a way to get it open
1369,1811818547,False,finalized,5,7/15/2018 19:37:18,1,1.0,7/13/2018 18:17:17,1810990966,7/13/2018 18:17:17,,,Wonderful...can you bring up some decaff,0,0,0,0,0,0,0,wonderful can you bring up some decaff
1370,1811814282,False,finalized,5,7/15/2018 12:16:23,2,1.0,7/13/2018 18:16:41,1810986579,7/13/2018 18:16:41,,,Hi is there a pool or a hot tub on the premise?,1,0,0,0,0,0,1,hi is there a pool or a hot tub on the premise
1371,1811816432,False,finalized,5,7/15/2018 7:17:43,2,0.8137,7/13/2018 18:16:59,1810988779,7/13/2018 18:16:59,,,Hiya do you have umbrellas at the hotel,1,0,0,0,0,0,1,hiya do you have umbrellas at the hotel
1372,1811815994,False,finalized,5,7/15/2018 20:27:49,2,0.5686,7/13/2018 18:16:55,1810988336,7/13/2018 18:16:55,,,What time does the pool close at the Lamarr location,1,0,1,0,0,0,1,what time does the pool close at the lamarr location
1373,1811816167,False,finalized,5,7/15/2018 18:53:03,2,1.0,7/13/2018 18:16:56,1810988510,7/13/2018 18:16:56,,,Suggestions for where we should try to park this evening which is anywhere near the apartment?,1,0,0,0,0,0,1,suggestions for where we should try to park this evening which is anywhere near the apartment
1374,1811818425,False,finalized,5,7/16/2018 2:34:30,2,0.5962,7/13/2018 18:17:16,1810990839,7/13/2018 18:17:16,,,Do you know what kind of brand your sheets are?,1,0,1,0,0,0,1,do you know what kind of brand your sheets are
1375,1811814614,False,finalized,5,7/15/2018 14:05:55,3,1.0,7/13/2018 18:16:44,1810986923,7/13/2018 18:16:44,,,"Hi, when do you expect our room to be ready?",0,0,0,0,0,0,0,hi when do you expect our room to be ready
1376,1811816633,False,finalized,5,7/16/2018 1:42:51,3,0.8059,7/13/2018 18:17:00,1810988988,7/13/2018 18:17:00,,,"Hi there, is there a way to extend my stay another night?",0,0,0,0,0,0,0,hi there is there a way to extend my stay another night
1377,1811817156,False,finalized,5,7/15/2018 11:43:48,2,1.0,7/13/2018 18:17:05,1810989530,7/13/2018 18:17:05,,,"Hi, what is the earliest we can arrive please and is there 24 bicycle hire nearby? .Susan",1,0,0,0,0,0,1,hi what is the earliest we can arrive please and is there bicycle hire nearby susan
1378,1811816125,False,finalized,5,7/16/2018 3:31:17,2,0.6139,7/13/2018 18:16:56,1810988467,7/13/2018 18:16:56,,,"Hi, is it possible to receive mail order delivery while there?",1,0,1,0,0,0,1,hi is it possible to receive mail order delivery while there
1379,1811814230,False,finalized,5,7/15/2018 23:29:57,2,0.5896,7/13/2018 18:16:41,1810986527,7/13/2018 18:16:41,,,"I am aware that the check in time is at 3pm, is there any way we could check in earlier?",1,0,1,0,0,0,1,i am aware that the check in time is at pm is there any way we could check in earlier
1380,1811814884,False,finalized,5,7/15/2018 20:05:13,2,1.0,7/13/2018 18:16:46,1810987197,7/13/2018 18:16:46,,,Also where can I find a list of kid friendly activities (10 and 7 yr old).,1,0,0,0,0,0,1,also where can i find a list of kid friendly activities and yr old
1381,1811815253,False,finalized,5,7/15/2018 20:34:01,2,0.8033,7/13/2018 18:16:49,1810987576,7/13/2018 18:16:49,,,And where the fire pit?,1,0,0,0,0,0,1,and where the fire pit
1382,1811818436,False,finalized,5,7/15/2018 7:28:32,2,1.0,7/13/2018 18:17:16,1810990850,7/13/2018 18:17:16,,,Hello again what are the hours for the MS Grill today?,1,0,0,0,0,0,1,hello again what are the hours for the ms grill today
1383,1811813376,False,finalized,5,7/16/2018 1:47:59,2,1.0,7/13/2018 18:16:34,1810985648,7/13/2018 18:16:34,,,Can you tell me what time the breakfast buffet runs and how much it is please,1,0,0,0,0,0,1,can you tell me what time the breakfast buffet runs and how much it is please
1384,1811815720,False,finalized,5,7/15/2018 18:29:02,2,0.7905,7/13/2018 18:16:53,1810988055,7/13/2018 18:16:53,,,How fast can you get me SUV???,1,0,0,0,0,0,1,how fast can you get me suv
1385,1811815077,False,finalized,5,7/16/2018 0:13:08,3,0.5865,7/13/2018 18:16:47,1810987397,7/13/2018 18:16:47,,,ETA when room will be ready ?,0,0,1,0,0,0,0,eta when room will be ready
1386,1811817957,False,finalized,5,7/16/2018 0:21:07,2,1.0,7/13/2018 18:17:12,1810990357,7/13/2018 18:17:12,,,You guys don’t have a connection for bucks tickets tonight do you?,1,0,0,0,0,0,1,you guys don t have a connection for bucks tickets tonight do you
1387,1811815215,False,finalized,5,7/16/2018 2:27:37,3,0.8381,7/13/2018 18:16:49,1810987536,7/13/2018 18:16:49,,,Just curious how long do ya think it will take for our room to be ready,0,0,0,0,0,0,0,just curious how long do ya think it will take for our room to be ready
1388,1811815691,False,finalized,6,7/15/2018 8:50:38,0,0.823,7/13/2018 18:16:53,1810988026,7/13/2018 18:16:53,,,"If not, what does it cost?",0,0,0,0,0,0,0,if not what does it cost
1389,1811816109,False,finalized,5,7/15/2018 20:03:17,2,1.0,7/13/2018 18:16:56,1810988450,7/13/2018 18:16:56,,,So what's the earliest possible time for checking in today then?,1,0,0,0,0,0,1,so what s the earliest possible time for checking in today then
1390,1811816377,False,finalized,5,7/15/2018 18:10:20,0,1.0,7/13/2018 18:16:58,1810988726,7/13/2018 18:16:58,,,Hi - when will we get it?,0,0,0,0,0,0,0,hi when will we get it
1391,1811818164,False,finalized,5,7/16/2018 1:24:54,2,1.0,7/13/2018 18:17:13,1810990573,7/13/2018 18:17:13,,,What time does the Starbucks open in the hotel lobby area,1,0,0,0,0,0,1,what time does the starbucks open in the hotel lobby area
1392,1811814258,False,finalized,5,7/15/2018 14:37:31,2,1.0,7/13/2018 18:16:41,1810986555,7/13/2018 18:16:41,,,What time does the roof top bar close?,1,0,0,0,0,0,1,what time does the roof top bar close
1393,1811818023,False,finalized,5,7/15/2018 22:44:32,2,1.0,7/13/2018 18:17:12,1810990427,7/13/2018 18:17:12,,,What time does the club room close?,1,0,0,0,0,0,1,what time does the club room close
1394,1811818071,False,finalized,5,7/15/2018 10:43:18,2,0.8047,7/13/2018 18:17:12,1810990478,7/13/2018 18:17:12,,,Does Blu serve food or is it only drinks?,1,0,0,0,0,0,1,does blu serve food or is it only drinks
1395,1811818365,False,finalized,5,7/15/2018 11:57:39,2,1.0,7/13/2018 18:17:15,1810990778,7/13/2018 18:17:15,,,I do have a question - what are the hours for the gym?,1,0,0,0,0,0,1,i do have a question what are the hours for the gym
1396,1811814438,False,finalized,5,7/15/2018 18:11:13,2,1.0,7/13/2018 18:16:43,1810986742,7/13/2018 18:16:43,,,How far of a walk is it as several of us want to go earlier,1,0,0,0,0,0,1,how far of a walk is it as several of us want to go earlier
1397,1811814463,False,finalized,5,7/15/2018 19:32:38,2,1.0,7/13/2018 18:16:43,1810986768,7/13/2018 18:16:43,,,"Hello., what is the best way to get to the resort from fort Myers airport?",1,0,0,0,0,0,1,hello what is the best way to get to the resort from fort myers airport
1398,1811817764,False,finalized,5,7/16/2018 4:15:27,2,0.7916,7/13/2018 18:17:10,1810990157,7/13/2018 18:17:10,,,"Last question before we leave, is there a charge if we drink the water bottles in the refrigerator?",1,0,0,0,0,0,1,last question before we leave is there a charge if we drink the water bottles in the refrigerator
1399,1811818621,False,finalized,5,7/16/2018 5:14:19,2,0.8094,7/13/2018 18:17:17,1810991044,7/13/2018 18:17:17,,,Oh also what is our wifi access code?,1,0,0,0,0,0,1,oh also what is our wifi access code
1400,1811814652,False,finalized,5,7/15/2018 23:58:40,2,1.0,7/13/2018 18:16:44,1810986962,7/13/2018 18:16:44,,,"For parking, what are the rates for valet vs self park?",1,0,0,0,0,0,1,for parking what are the rates for valet vs self park
1401,1811818798,False,finalized,5,7/15/2018 5:41:41,0,1.0,7/13/2018 18:17:19,1810991225,7/13/2018 18:17:19,,,Or is it a wait in line place?,0,0,0,0,0,0,0,or is it a wait in line place
1402,1811816873,False,finalized,5,7/15/2018 11:57:14,2,1.0,7/13/2018 18:17:02,1810989237,7/13/2018 18:17:02,,,"Hello, I wanted to find out, what is the latest time I would be able to check out today?",1,0,0,0,0,0,1,hello i wanted to find out what is the latest time i would be able to check out today
1403,1811818480,False,finalized,5,7/15/2018 19:34:11,2,0.5956,7/13/2018 18:17:16,1810990894,7/13/2018 18:17:16,,,can we please have our car brought out?,1,0,1,0,0,0,1,can we please have our car brought out
1404,1811815762,False,finalized,5,7/16/2018 2:49:27,1,0.8061,7/13/2018 18:16:53,1810988098,7/13/2018 18:16:53,,,Can you text us when our room is ready please,0,0,0,0,0,0,0,can you text us when our room is ready please
1405,1811818028,False,finalized,5,7/16/2018 2:16:14,2,1.0,7/13/2018 18:17:12,1810990433,7/13/2018 18:17:12,,,"Good morning what time can I get my continental breakfast, I need the name and the location.",1,0,0,0,0,0,1,good morning what time can i get my continental breakfast i need the name and the location
1406,1811813913,False,finalized,5,7/16/2018 1:23:55,2,1.0,7/13/2018 18:16:39,1810986200,7/13/2018 18:16:39,,,Everything is great but where is the ice machine,1,0,0,0,0,0,1,everything is great but where is the ice machine
1407,1811819128,False,finalized,5,7/15/2018 12:09:43,1,0.8119,7/13/2018 18:17:22,1810991582,7/13/2018 18:17:22,,,"There is only one key, can we get an extra door key?",0,0,0,0,0,0,0,there is only one key can we get an extra door key
1408,1811815004,False,finalized,5,7/15/2018 19:59:35,2,0.5820000000000001,7/13/2018 18:16:47,1810987324,7/13/2018 18:16:47,,,what other features do you guys have ?,1,0,1,0,0,0,1,what other features do you guys have
1409,1811816919,False,finalized,5,7/15/2018 19:13:31,0,0.6071,7/13/2018 18:17:03,1810989284,7/13/2018 18:17:03,,,how many tangerines would you like?,0,0,1,0,0,0,0,how many tangerines would you like
1410,1811814287,False,finalized,5,7/15/2018 12:31:15,2,1.0,7/13/2018 18:16:41,1810986584,7/13/2018 18:16:41,,,"Also, what are your prices on parking (nonvalet vs valet)?",1,0,0,0,0,0,1,also what are your prices on parking nonvalet vs valet
1411,1811815100,False,finalized,5,7/16/2018 3:27:38,2,0.5794,7/13/2018 18:16:48,1810987420,7/13/2018 18:16:48,,,Or can you recommend a nearby service,1,0,1,0,0,0,1,or can you recommend a nearby service
