,_unit_id,_golden,_unit_state,_trusted_judgments,_last_judgment_at,choose_the_most_natural_answer_to_the_question_above,choose_the_most_natural_answer_to_the_question_above:confidence,_created_at,orig__unit_id,_updated_at,choose_the_most_natural_answer_to_the_question_above_gold,choose_the_most_natural_answer_to_the_question_above_gold_reason,would_you_be_able_to_tell_me_what_the_balance_on_my_room_is,Label,Diff,Low_confidence,Low_confidence & diff,both_low_conf_with_diff,high_conf_toby_low_conf_info_desk_with_diff,label_ml,cleaned_sent
3095,1811816655,False,finalized,5,7/15/2018 10:17:26,2,1.0,7/13/2018 18:17:00,1810989010,7/13/2018 18:17:00,,,And what about parking?,1,0,0,0,0,0,1,and what about parking
3096,1811817445,False,finalized,5,7/15/2018 14:00:55,2,0.7961,7/13/2018 18:17:07,1810989829,7/13/2018 18:17:07,,,Is the coffee included with the stay or is it $5/pack used?,1,0,0,0,0,0,1,is the coffee included with the stay or is it pack used
3097,1811813187,False,finalized,7,7/15/2018 15:17:52,1,0.8566,7/13/2018 18:16:33,1810985454,7/13/2018 18:16:33,,,"Hi!, can you service lime and salt to room 1248??",0,0,0,0,0,0,0,hi can you service lime and salt to room
3098,1811818765,False,finalized,5,7/15/2018 19:17:57,2,1.0,7/13/2018 18:17:19,1810991191,7/13/2018 18:17:19,,,"Hi, what is the earliest we can check in today?",1,0,0,0,0,0,1,hi what is the earliest we can check in today
3099,1811816231,False,finalized,5,7/15/2018 20:40:22,0,0.8261,7/13/2018 18:16:57,1810988577,7/13/2018 18:16:57,,,"I'm sitting in the hall, what do you need to get this resolved",0,0,0,0,0,0,0,i m sitting in the hall what do you need to get this resolved
3100,1811816405,False,finalized,6,7/15/2018 8:45:32,2,0.6814,7/13/2018 18:16:58,1810988752,7/13/2018 18:16:58,,,Or can we leave our bags in the leasing office here?,1,0,1,0,0,0,1,or can we leave our bags in the leasing office here
3101,1811813279,False,finalized,5,7/15/2018 0:32:44,2,0.5866,7/13/2018 18:16:34,1810985547,7/13/2018 18:16:34,,,I just checked minutes ago about my room 800 is it ready?,1,0,1,0,0,0,1,i just checked minutes ago about my room is it ready
3102,1811815136,False,finalized,5,7/16/2018 1:28:45,2,0.785,7/13/2018 18:16:48,1810987456,7/13/2018 18:16:48,,,Hello can we use debit for our $100 incidental fee?,1,0,0,0,0,0,1,hello can we use debit for our incidental fee
3103,1811817343,False,finalized,5,7/15/2018 23:45:47,0,0.6275,7/13/2018 18:17:06,1810989723,7/13/2018 18:17:06,,,Ok cool is it the print press building?,0,0,1,0,0,0,0,ok cool is it the print press building
3104,1811813521,False,finalized,6,7/15/2018 18:09:46,2,1.0,7/13/2018 18:16:36,1810985802,7/13/2018 18:16:36,,,For the property management who owns the hotel?,1,0,0,0,0,0,1,for the property management who owns the hotel
3105,1811815467,False,finalized,6,7/15/2018 18:08:27,2,0.8169,7/13/2018 18:16:51,1810987795,7/13/2018 18:16:51,,,Hello - is there a switch for the plunge pool jets,1,0,0,0,0,0,1,hello is there a switch for the plunge pool jets
3106,1811814157,False,finalized,5,7/15/2018 18:59:27,2,1.0,7/13/2018 18:16:40,1810986450,7/13/2018 18:16:40,,,Hello can someone tell me what we do about parking?,1,0,0,0,0,0,1,hello can someone tell me what we do about parking
3107,1811814928,False,finalized,5,7/16/2018 1:46:10,2,0.627,7/13/2018 18:16:46,1810987243,7/13/2018 18:16:46,,,"Also, she is getting in earlier in the day so can we request an early check out?",1,0,1,0,0,0,1,also she is getting in earlier in the day so can we request an early check out
3108,1811816159,False,finalized,5,7/15/2018 11:42:44,0,0.409,7/13/2018 18:16:56,1810988502,7/13/2018 18:16:56,,,can i chk in now?,0,0,1,0,0,0,0,can i chk in now
3109,1811819062,False,finalized,5,7/15/2018 13:05:15,2,1.0,7/13/2018 18:17:21,1810991508,7/13/2018 18:17:21,,,And do you have a spa?,1,0,0,0,0,0,1,and do you have a spa
3110,1811814404,False,finalized,6,7/15/2018 17:37:05,2,1.0,7/13/2018 18:16:42,1810986707,7/13/2018 18:16:42,,,"For breakfast options, do you have any gluten free choices.",1,0,0,0,0,0,1,for breakfast options do you have any gluten free choices
3111,1811818487,False,finalized,5,7/15/2018 17:58:46,0,0.5833,7/13/2018 18:17:16,1810990901,7/13/2018 18:17:16,,,Can you tell us where it is parked?,0,0,1,0,0,0,0,can you tell us where it is parked
3112,1811815992,False,finalized,5,7/15/2018 5:56:02,2,1.0,7/13/2018 18:16:55,1810988334,7/13/2018 18:16:55,,,"Sorry another question, where do we park?",1,0,0,0,0,0,1,sorry another question where do we park
3113,1811816340,False,finalized,7,7/15/2018 14:57:44,2,1.0,7/13/2018 18:16:58,1810988688,7/13/2018 18:16:58,,,Do you suggest some place where I can drop off my luggage now?!,1,0,0,0,0,0,1,do you suggest some place where i can drop off my luggage now
3114,1811818283,False,finalized,5,7/15/2018 18:55:30,2,0.7922,7/13/2018 18:17:14,1810990693,7/13/2018 18:17:14,,,What time does the pool open?,1,0,0,0,0,0,1,what time does the pool open
3115,1811814215,False,finalized,5,7/15/2018 17:52:13,2,0.7864,7/13/2018 18:16:41,1810986512,7/13/2018 18:16:41,,,we assume the afternoon tour starts at 2 pm?.From what location?,1,0,0,0,0,0,1,we assume the afternoon tour starts at pm from what location
3116,1811817887,False,finalized,5,7/15/2018 21:36:07,2,0.4169,7/13/2018 18:17:11,1810990288,7/13/2018 18:17:11,,,"Hello, I was wondering how old you have to be to reserve a room?",1,0,1,0,0,0,1,hello i was wondering how old you have to be to reserve a room
3117,1811818320,False,finalized,5,7/15/2018 14:38:59,2,1.0,7/13/2018 18:17:15,1810990731,7/13/2018 18:17:15,,,On what floor is the Club?,1,0,0,0,0,0,1,on what floor is the club
3118,1811815441,False,finalized,5,7/15/2018 6:22:49,0,0.7864,7/13/2018 18:16:51,1810987767,7/13/2018 18:16:51,,,but can you confirm?,0,0,0,0,0,0,0,but can you confirm
3119,1811814144,False,finalized,5,7/15/2018 14:22:19,2,0.7981,7/13/2018 18:16:40,1810986435,7/13/2018 18:16:40,,,Just a few questions: what time is check in?,1,0,0,0,0,0,1,just a few questions what time is check in
3120,1811813755,False,finalized,5,7/15/2018 18:17:28,2,0.5849,7/13/2018 18:16:37,1810986040,7/13/2018 18:16:37,,,What time can we check in,1,0,1,0,0,0,1,what time can we check in
3121,1811813927,False,finalized,5,7/15/2018 13:45:47,2,1.0,7/13/2018 18:16:39,1810986214,7/13/2018 18:16:39,,,How much is it to print black&white per page?,1,0,0,0,0,0,1,how much is it to print black white per page
3122,1811815910,False,finalized,5,7/15/2018 8:17:08,0,1.0,7/13/2018 18:16:54,1810988247,7/13/2018 18:16:54,,,Where do you meet?,0,0,0,0,0,0,0,where do you meet
3123,1811816700,False,finalized,6,7/15/2018 18:09:11,2,0.8246,7/13/2018 18:17:01,1810989056,7/13/2018 18:17:01,,,do you know how the grill works?,1,0,0,0,0,0,1,do you know how the grill works
3124,1811817070,False,finalized,5,7/15/2018 20:46:13,2,0.7864,7/13/2018 18:17:04,1810989439,7/13/2018 18:17:04,,,"Hello again, what time does the pool close",1,0,0,0,0,0,1,hello again what time does the pool close
3125,1811813568,False,finalized,5,7/16/2018 2:47:25,2,1.0,7/13/2018 18:16:36,1810985850,7/13/2018 18:16:36,,,Hey i am mrs vazquez in room 1020 what time the store close,1,0,0,0,0,0,1,hey i am mrs vazquez in room what time the store close
3126,1811816400,False,finalized,5,7/15/2018 18:20:22,2,0.4218,7/13/2018 18:16:58,1810988747,7/13/2018 18:16:58,,,May I ask who is assisting me so I can give a good review when I arrive? :),1,0,1,0,0,0,1,may i ask who is assisting me so i can give a good review when i arrive
3127,1811816623,False,finalized,5,7/15/2018 13:08:27,2,1.0,7/13/2018 18:17:00,1810988978,7/13/2018 18:17:00,,,"Hi, where can we throw the trash?.",1,0,0,0,0,0,1,hi where can we throw the trash
3128,1811818017,False,finalized,5,7/15/2018 13:25:29,0,0.8190000000000001,7/13/2018 18:17:12,1810990421,7/13/2018 18:17:12,,,Or is it easier if we come down to discuss?,0,0,0,0,0,0,0,or is it easier if we come down to discuss
3129,1811818250,False,finalized,5,7/15/2018 6:38:02,2,0.7938,7/13/2018 18:17:14,1810990659,7/13/2018 18:17:14,,,"but I am in need of ice, where is it?",1,0,0,0,0,0,1,but i am in need of ice where is it
3130,1811816556,False,finalized,5,7/15/2018 6:27:05,0,1.0,7/13/2018 18:17:00,1810988908,7/13/2018 18:17:00,,,what's going on??,0,0,0,0,0,0,0,what s going on
3131,1811817641,False,finalized,5,7/15/2018 16:21:01,3,0.4059,7/13/2018 18:17:09,1810990031,7/13/2018 18:17:09,,,So what would a typical week cost?,0,0,1,0,0,0,0,so what would a typical week cost
3132,1811813991,False,finalized,5,7/16/2018 2:13:18,2,1.0,7/13/2018 18:16:39,1810986278,7/13/2018 18:16:39,,,You don't have a airport shuttle do you?,1,0,0,0,0,0,1,you don t have a airport shuttle do you
3133,1811817815,False,finalized,5,7/15/2018 19:12:02,2,0.5886,7/13/2018 18:17:10,1810990210,7/13/2018 18:17:10,,,And may I ask who I am speaking with?,1,0,1,0,0,0,1,and may i ask who i am speaking with
3134,1811814234,False,finalized,5,7/15/2018 18:49:26,2,0.8087,7/13/2018 18:16:41,1810986531,7/13/2018 18:16:41,,,"Yes, can you recommend a place for a massage?",1,0,0,0,0,0,1,yes can you recommend a place for a massage
3135,1811817734,False,finalized,5,7/15/2018 17:58:08,2,0.8,7/13/2018 18:17:09,1810990124,7/13/2018 18:17:09,,,I'm staying in room 212 and was wondering what time check out is?,1,0,0,0,0,0,1,i m staying in room and was wondering what time check out is
3136,1811814721,False,finalized,5,7/16/2018 2:16:34,2,0.606,7/13/2018 18:16:45,1810987033,7/13/2018 18:16:45,,,"Is there a late check out option, and if so, what time is it?",1,0,1,0,0,0,1,is there a late check out option and if so what time is it
3137,1811813427,False,finalized,5,7/15/2018 13:04:56,2,1.0,7/13/2018 18:16:35,1810985704,7/13/2018 18:16:35,,,"Hello, what resteraunts are in the hotel we can take our kids too?",1,0,0,0,0,0,1,hello what resteraunts are in the hotel we can take our kids too
3138,1811814845,False,finalized,5,7/15/2018 7:29:40,2,0.8155,7/13/2018 18:16:46,1810987159,7/13/2018 18:16:46,,,"Thank you , what time is check in?",1,0,0,0,0,0,1,thank you what time is check in
3139,1811816653,False,finalized,5,7/15/2018 20:40:22,1,0.4327,7/13/2018 18:17:00,1810989008,7/13/2018 18:17:00,,,"Hi can you please call me, I have a few questions.",0,0,1,0,0,0,0,hi can you please call me i have a few questions
3140,1811816881,False,finalized,5,7/15/2018 9:52:44,2,1.0,7/13/2018 18:17:02,1810989245,7/13/2018 18:17:02,,,"And if I select to pay for parking, how does that work?",1,0,0,0,0,0,1,and if i select to pay for parking how does that work
3141,1811815507,False,finalized,5,7/15/2018 15:36:34,0,0.6047,7/13/2018 18:16:51,1810987836,7/13/2018 18:16:51,,,Do you know how much experience is needed?,0,0,1,0,0,0,0,do you know how much experience is needed
3142,1811818251,False,finalized,6,7/15/2018 18:00:03,2,1.0,7/13/2018 18:17:14,1810990660,7/13/2018 18:17:14,,,What street does the parade pass on and what time is it?,1,0,0,0,0,0,1,what street does the parade pass on and what time is it
3143,1811817296,False,finalized,5,7/15/2018 11:03:08,1,1.0,7/13/2018 18:17:06,1810989675,7/13/2018 18:17:06,,,can you please answer my phone call,0,0,0,0,0,0,0,can you please answer my phone call
3144,1811817941,False,finalized,5,7/16/2018 2:49:17,3,0.7972,7/13/2018 18:17:11,1810990340,7/13/2018 18:17:11,,,what room will we put them in,0,0,0,0,0,0,0,what room will we put them in
3145,1811815038,False,finalized,5,7/15/2018 22:08:17,2,1.0,7/13/2018 18:16:47,1810987360,7/13/2018 18:16:47,,,How early can we arrive to enjoy the pools?,1,0,0,0,0,0,1,how early can we arrive to enjoy the pools
3146,1811814360,False,finalized,5,7/15/2018 6:15:51,2,0.6214,7/13/2018 18:16:42,1810986660,7/13/2018 18:16:42,,,"Hello, do you have early checkin available today?",1,0,1,0,0,0,1,hello do you have early checkin available today
3147,1811816591,False,finalized,5,7/15/2018 18:14:07,0,0.8073,7/13/2018 18:17:00,1810988944,7/13/2018 18:17:00,,,Or is it strictly at 3?,0,0,0,0,0,0,0,or is it strictly at
3148,1811818015,False,finalized,6,7/15/2018 14:58:05,2,1.0,7/13/2018 18:17:12,1810990418,7/13/2018 18:17:12,,,What time does the pool open?,1,0,0,0,0,0,1,what time does the pool open
3149,1811819045,False,finalized,5,7/16/2018 1:33:25,0,0.8037,7/13/2018 18:17:21,1810991489,7/13/2018 18:17:21,,,"d, if we do, do you think it is helpful to buy them in advance?",0,0,0,0,0,0,0,d if we do do you think it is helpful to buy them in advance
3150,1811815208,False,finalized,5,7/16/2018 2:32:46,2,0.6078,7/13/2018 18:16:49,1810987528,7/13/2018 18:16:49,,,"Good , is there any oceon fro t view room that we can move to please",1,0,1,0,0,0,1,good is there any oceon fro t view room that we can move to please
3151,1811816830,False,finalized,5,7/15/2018 15:47:33,3,0.8155,7/13/2018 18:17:02,1810989194,7/13/2018 18:17:02,,,"Great, what's the room #?",0,0,0,0,0,0,0,great what s the room
3152,1811816093,False,finalized,5,7/16/2018 2:41:30,2,1.0,7/13/2018 18:16:56,1810988434,7/13/2018 18:16:56,,,Where can we drop bags off?,1,0,0,0,0,0,1,where can we drop bags off
3153,1811817539,False,finalized,5,7/15/2018 13:34:47,2,1.0,7/13/2018 18:17:08,1810989926,7/13/2018 18:17:08,,,Another question: is it easy to get packages?,1,0,0,0,0,0,1,another question is it easy to get packages
3154,1811814396,False,finalized,5,7/15/2018 4:49:31,0,0.6,7/13/2018 18:16:42,1810986698,7/13/2018 18:16:42,,,I’m sorry which facility you are sending from?,0,0,1,0,0,0,0,i m sorry which facility you are sending from
3155,1811816011,False,finalized,5,7/15/2018 20:39:18,0,0.7822,7/13/2018 18:16:55,1810988353,7/13/2018 18:16:55,,,I don't think I have what do you think I have :-),0,0,0,0,0,0,0,i don t think i have what do you think i have
3156,1811817692,False,finalized,5,7/15/2018 6:21:30,2,1.0,7/13/2018 18:17:09,1810990083,7/13/2018 18:17:09,,,Tell me how to get in the parking lot.,1,0,0,0,0,0,1,tell me how to get in the parking lot
3157,1811818419,False,finalized,5,7/16/2018 1:54:25,2,1.0,7/13/2018 18:17:16,1810990832,7/13/2018 18:17:16,,,What time and where is breakfast tomorrow morning?,1,0,0,0,0,0,1,what time and where is breakfast tomorrow morning
3158,1811816110,False,finalized,5,7/16/2018 2:36:23,2,1.0,7/13/2018 18:16:56,1810988451,7/13/2018 18:16:56,,,do you have any suggestions on where I can go to get healthy local food?,1,0,0,0,0,0,1,do you have any suggestions on where i can go to get healthy local food
3159,1811813688,False,finalized,5,7/15/2018 18:27:54,2,0.8095,7/13/2018 18:16:37,1810985972,7/13/2018 18:16:37,,,How do you set up the safe?,1,0,0,0,0,0,1,how do you set up the safe
3160,1811819146,False,finalized,5,7/15/2018 20:59:15,0,1.0,7/13/2018 18:17:22,1810991602,7/13/2018 18:17:22,,,what about weekly ?,0,0,0,0,0,0,0,what about weekly
3161,1811817216,False,finalized,5,7/15/2018 5:43:21,2,0.8019,7/13/2018 18:17:05,1810989591,7/13/2018 18:17:05,,,Do you know how far that one is from the Facebook office?,1,0,0,0,0,0,1,do you know how far that one is from the facebook office
3162,1811815451,False,finalized,5,7/15/2018 18:57:21,3,0.6154,7/13/2018 18:16:51,1810987777,7/13/2018 18:16:51,,,can we make a reservation at los tres gallos tonight?,0,0,1,0,0,0,0,can we make a reservation at los tres gallos tonight
3163,1811817748,False,finalized,6,7/15/2018 13:39:53,2,0.6716,7/13/2018 18:17:10,1810990138,7/13/2018 18:17:10,,,"Also, what do we do with the recycle bin.",1,0,1,0,0,0,1,also what do we do with the recycle bin
3164,1811814140,False,finalized,5,7/15/2018 12:13:26,0,1.0,7/13/2018 18:16:40,1810986430,7/13/2018 18:16:40,,,Creepy.. who is this?,0,0,0,0,0,0,0,creepy who is this
3165,1811818048,False,finalized,5,7/15/2018 19:00:41,0,0.5738,7/13/2018 18:17:12,1810990453,7/13/2018 18:17:12,,,"2 glasses, what are the champs options",0,0,1,0,0,0,0,glasses what are the champs options
3166,1811814446,False,finalized,5,7/15/2018 11:18:26,3,0.4057,7/13/2018 18:16:43,1810986750,7/13/2018 18:16:43,,,"Will notifications be sent via text, like when our room is ready, etc?",0,0,1,0,0,0,0,will notifications be sent via text like when our room is ready etc
3167,1811818502,False,finalized,5,7/16/2018 1:53:58,2,0.5673,7/13/2018 18:17:16,1810990916,7/13/2018 18:17:16,,,Is a DVD player available or is it extra?,1,0,1,0,0,0,1,is a dvd player available or is it extra
3168,1811815972,False,finalized,5,7/15/2018 20:05:04,2,0.6025,7/13/2018 18:16:55,1810988312,7/13/2018 18:16:55,,,The room I booked at the website which time can I check in,1,0,1,0,0,0,1,the room i booked at the website which time can i check in
3169,1811814957,False,finalized,5,7/15/2018 14:51:36,2,1.0,7/13/2018 18:16:46,1810987276,7/13/2018 18:16:46,,,"Hi, do you have a kids club?",1,0,0,0,0,0,1,hi do you have a kids club
3170,1811815784,False,finalized,5,7/15/2018 23:47:15,2,1.0,7/13/2018 18:16:53,1810988120,7/13/2018 18:16:53,,,What type of room decor do you offer?,1,0,0,0,0,0,1,what type of room decor do you offer
3171,1811816132,False,finalized,5,7/15/2018 13:59:07,0,0.5941,7/13/2018 18:16:56,1810988475,7/13/2018 18:16:56,,,what code should we use,0,0,1,0,0,0,0,what code should we use
3172,1811817843,False,finalized,6,7/15/2018 7:19:07,2,1.0,7/13/2018 18:17:11,1810990240,7/13/2018 18:17:11,,,(1) what is the cost for parking?,1,0,0,0,0,0,1,what is the cost for parking
3173,1811816975,False,finalized,5,7/16/2018 2:32:46,2,1.0,7/13/2018 18:17:03,1810989342,7/13/2018 18:17:03,,,"I get in early tomorrow, is there any way to get in before 3?",1,0,0,0,0,0,1,i get in early tomorrow is there any way to get in before
3174,1811817846,False,finalized,5,7/15/2018 12:44:18,0,1.0,7/13/2018 18:17:11,1810990243,7/13/2018 18:17:11,,,how do i do that,0,0,0,0,0,0,0,how do i do that
3175,1811816494,False,finalized,5,7/15/2018 20:43:03,2,0.7843,7/13/2018 18:16:59,1810988844,7/13/2018 18:16:59,,,What can we select to watch TV for free?,1,0,0,0,0,0,1,what can we select to watch tv for free
3176,1811813771,False,finalized,5,7/15/2018 6:02:58,2,1.0,7/13/2018 18:16:37,1810986055,7/13/2018 18:16:37,,,Hi this is mrs Baird in 602 I was wondering how to log on to the wifi,1,0,0,0,0,0,1,hi this is mrs baird in i was wondering how to log on to the wifi
3177,1811818172,False,finalized,5,7/15/2018 22:51:07,2,1.0,7/13/2018 18:17:13,1810990582,7/13/2018 18:17:13,,,What time does the pool close?,1,0,0,0,0,0,1,what time does the pool close
3178,1811817291,False,finalized,5,7/15/2018 11:10:02,2,1.0,7/13/2018 18:17:06,1810989670,7/13/2018 18:17:06,,,"When I'm checking out later, do I have to take the garbage any where?",1,0,0,0,0,0,1,when i m checking out later do i have to take the garbage any where
3179,1811816550,False,finalized,5,7/15/2018 18:25:50,2,0.5963,7/13/2018 18:17:00,1810988902,7/13/2018 18:17:00,,,How will they get towed if they pay the fee when they leave?,1,0,1,0,0,0,1,how will they get towed if they pay the fee when they leave
3180,1811815364,False,finalized,5,7/15/2018 17:24:32,2,1.0,7/13/2018 18:16:50,1810987691,7/13/2018 18:16:50,,,Do you have transportation from airport and how much is it we are 4 people,1,0,0,0,0,0,1,do you have transportation from airport and how much is it we are people
3181,1811817741,False,finalized,5,7/15/2018 11:43:10,2,0.598,7/13/2018 18:17:10,1810990131,7/13/2018 18:17:10,,,Hi is there any lost and found at the Guild at the Corazon?,1,0,1,0,0,0,1,hi is there any lost and found at the guild at the corazon
3182,1811817230,False,finalized,5,7/15/2018 16:38:09,0,0.7885,7/13/2018 18:17:05,1810989605,7/13/2018 18:17:05,,,"Hello Guild staff,.I'm unsure when we will arrive on Sunday--maybe 7pm?",0,0,0,0,0,0,0,hello guild staff i m unsure when we will arrive on sunday maybe pm
3183,1811814369,False,finalized,5,7/16/2018 1:22:03,2,1.0,7/13/2018 18:16:42,1810986670,7/13/2018 18:16:42,,,Do you have a restaurant at your hotel where I can get an omelette Sat morning?,1,0,0,0,0,0,1,do you have a restaurant at your hotel where i can get an omelette sat morning
3184,1811813744,False,finalized,5,7/15/2018 18:11:41,0,0.4167,7/13/2018 18:16:37,1810986029,7/13/2018 18:16:37,,,room when we arrive?,0,0,1,0,0,0,0,room when we arrive
3185,1811817918,False,finalized,5,7/15/2018 23:38:08,2,0.7911,7/13/2018 18:17:11,1810990317,7/13/2018 18:17:11,,,Can you tell me how far is the St Paul Fish Company?,1,0,0,0,0,0,1,can you tell me how far is the st paul fish company
3186,1811818034,False,finalized,5,7/16/2018 1:54:29,2,0.8163,7/13/2018 18:17:12,1810990439,7/13/2018 18:17:12,,,Can you please tell me where I can mail a package?,1,0,0,0,0,0,1,can you please tell me where i can mail a package
3187,1811818724,False,finalized,5,7/15/2018 5:22:15,0,0.8081,7/13/2018 18:17:18,1810991149,7/13/2018 18:17:18,,,"Thanks, what .Is your name?",0,0,0,0,0,0,0,thanks what is your name
3188,1811814618,False,finalized,5,7/16/2018 2:27:37,3,0.4078,7/13/2018 18:16:44,1810986927,7/13/2018 18:16:44,,,Could you please tell me what time check out is?,0,0,1,0,0,0,0,could you please tell me what time check out is
3189,1811814170,False,finalized,5,7/15/2018 18:44:32,2,1.0,7/13/2018 18:16:40,1810986463,7/13/2018 18:16:40,,,Where do you recommend parking with in and out capabilities?,1,0,0,0,0,0,1,where do you recommend parking with in and out capabilities
3190,1811816599,False,finalized,5,7/15/2018 8:58:21,2,0.6146,7/13/2018 18:17:00,1810988952,7/13/2018 18:17:00,,,Hi is this where I park ?,1,0,1,0,0,0,1,hi is this where i park
3191,1811818844,False,finalized,5,7/15/2018 18:35:10,3,0.4135,7/13/2018 18:17:19,1810991270,7/13/2018 18:17:19,,,What can you have special in the room for my husband.,0,0,1,0,0,0,0,what can you have special in the room for my husband
3192,1811817688,False,finalized,5,7/15/2018 18:30:30,0,0.5849,7/13/2018 18:17:09,1810990079,7/13/2018 18:17:09,,,when it's done.,0,0,1,0,0,0,0,when it s done
3193,1811815642,False,finalized,5,7/15/2018 19:00:16,2,1.0,7/13/2018 18:16:52,1810987977,7/13/2018 18:16:52,,,How can we get a ride to Costco or Walmart?,1,0,0,0,0,0,1,how can we get a ride to costco or walmart
3194,1811814059,False,finalized,5,7/15/2018 18:19:30,2,0.7829999999999999,7/13/2018 18:16:40,1810986346,7/13/2018 18:16:40,,,if so where can I catch it?,1,0,0,0,0,0,1,if so where can i catch it
3195,1811815807,False,finalized,5,7/15/2018 8:28:58,0,1.0,7/13/2018 18:16:53,1810988141,7/13/2018 18:16:53,,,and what is the address ?,0,0,0,0,0,0,0,and what is the address
3196,1811814679,False,finalized,5,7/15/2018 11:15:42,0,1.0,7/13/2018 18:16:44,1810986989,7/13/2018 18:16:44,,,Can I do that when we arrive?,0,0,0,0,0,0,0,can i do that when we arrive
3197,1811818861,False,finalized,5,7/15/2018 5:31:15,0,1.0,7/13/2018 18:17:19,1810991288,7/13/2018 18:17:19,,,is it close by?,0,0,0,0,0,0,0,is it close by
3198,1811815180,False,finalized,5,7/15/2018 19:01:34,2,0.7718,7/13/2018 18:16:48,1810987499,7/13/2018 18:16:48,,,"Good morning, what time is checkout?",1,0,0,0,0,0,1,good morning what time is checkout
3199,1811818515,False,finalized,6,7/15/2018 17:29:21,2,1.0,7/13/2018 18:17:16,1810990931,7/13/2018 18:17:16,,,Do you know where we could buy hair care products?,1,0,0,0,0,0,1,do you know where we could buy hair care products
3200,1811819142,False,finalized,5,7/15/2018 18:28:56,0,0.8077,7/13/2018 18:17:22,1810991597,7/13/2018 18:17:22,,,Can you tell me where to find it?,0,0,0,0,0,0,0,can you tell me where to find it
3201,1811813998,False,finalized,6,7/15/2018 4:56:20,2,0.5,7/13/2018 18:16:39,1810986285,7/13/2018 18:16:39,,,Hello do you have any toothbrushs,1,0,1,0,0,0,1,hello do you have any toothbrushs
3202,1811815290,False,finalized,5,7/15/2018 6:25:53,2,0.8019,7/13/2018 18:16:49,1810987612,7/13/2018 18:16:49,,,"Hi, is it possible to make a reservation tonight at Manta for 2.",1,0,0,0,0,0,1,hi is it possible to make a reservation tonight at manta for
3203,1811818790,False,finalized,5,7/15/2018 11:19:43,2,1.0,7/13/2018 18:17:19,1810991217,7/13/2018 18:17:19,,,What is best way to get to the hotel from the airport and how far away is the Thompson?,1,0,0,0,0,0,1,what is best way to get to the hotel from the airport and how far away is the thompson
3204,1811815779,False,finalized,5,7/15/2018 18:19:18,0,0.7874,7/13/2018 18:16:53,1810988115,7/13/2018 18:16:53,,,I know between San Jose & Cabo San Lucas but where ?,0,0,0,0,0,0,0,i know between san jose cabo san lucas but where
3205,1811815573,False,finalized,5,7/16/2018 4:03:50,0,1.0,7/13/2018 18:16:52,1810987908,7/13/2018 18:16:52,,,When is it for?,0,0,0,0,0,0,0,when is it for
3206,1811816650,False,finalized,5,7/16/2018 1:35:28,2,0.8285,7/13/2018 18:17:00,1810989005,7/13/2018 18:17:00,,,and I was wondering how the parking works...,1,0,0,0,0,0,1,and i was wondering how the parking works
3207,1811816788,False,finalized,5,7/15/2018 18:18:06,2,0.8112,7/13/2018 18:17:02,1810989151,7/13/2018 18:17:02,,,I have coffee and water in the brewer but can't figure out how to brew the coffee.,1,0,0,0,0,0,1,i have coffee and water in the brewer but can t figure out how to brew the coffee
3208,1811813231,False,finalized,5,7/14/2018 22:25:56,3,1.0,7/13/2018 18:16:33,1810985500,7/13/2018 18:16:33,,,Wondering what time our room will be ready?,0,0,0,0,0,0,0,wondering what time our room will be ready
3209,1811817657,False,finalized,5,7/15/2018 17:30:25,0,1.0,7/13/2018 18:17:09,1810990047,7/13/2018 18:17:09,,,If so - what are rated?,0,0,0,0,0,0,0,if so what are rated
3210,1811815039,False,finalized,5,7/15/2018 5:13:11,2,0.8,7/13/2018 18:16:47,1810987361,7/13/2018 18:16:47,,,When do you do the room cleaning out the room,1,0,0,0,0,0,1,when do you do the room cleaning out the room
3211,1811817200,False,finalized,5,7/15/2018 12:54:29,1,0.8131,7/13/2018 18:17:05,1810989575,7/13/2018 18:17:05,,,"I never received the email, can you send it again?",0,0,0,0,0,0,0,i never received the email can you send it again
3212,1811815825,False,finalized,5,7/15/2018 20:17:50,2,0.7885,7/13/2018 18:16:54,1810988159,7/13/2018 18:16:54,,,Question 2: do you offer facials,1,0,0,0,0,0,1,question do you offer facials
